<izpack:shortcuts version="5.0"
                  xmlns:izpack="http://izpack.org/schema/shortcuts"
                  xmlns:xsi="http://www.w3.org/2001/XMLSchema-instance"
                  xsi:schemaLocation="http://izpack.org/schema/shortcuts http://izpack.org/schema/5.0/izpack-shortcuts-5.0.xsd">

  <skipIfNotSupported/>
  
  <programGroup defaultName="%MODEL_NAME%" location="applications"/>
  
  <shortcut
            name="%MODEL_NAME%"
            programGroup="yes"
            desktop="no"
            applications="no"
            startMenu="no"
            startup="no"
            target="$INSTALL_PATH\start_model.bat"
     		workingDirectory="$INSTALL_PATH"
            commandLine=""
            iconFile="$INSTALL_PATH\%PROJECT_NAME%\icons\model.bmp"
     		iconIndex="0"
     		initialState="noShow"
            description="This runs the model">
            
        <createForPack name="Model"/>
  </shortcut>
    
  <shortcut
            name="Documentation"
            programGroup="yes"
            desktop="no"
            applications="no"
            startMenu="no"
            startup="no"
            target="$INSTALL_PATH\%PROJECT_NAME%\docs\index.html"
            iconFile="%SystemRoot%\system32\SHELL32.dll"
     		iconIndex="23" 
     		workingDirectory="$INSTALL_PATH\docs"
            description="Model Documentation">

        <createForPack name="Documentation"/>
    </shortcut>

    <shortcut
            name="Model Uninstaller"
            programGroup="yes"
            desktop="no"
            applications="no"
            startMenu="no"
            startup="no"
            target="$INSTALL_PATH\Uninstaller\uninstaller.jar"
            workingDirectory="$INSTALL_PATH"
            commandLine=""
            iconFile="%SystemRoot%\system32\SHELL32.dll"
     		iconIndex="31"
            description="This uninstalls the model">
    	<createForPack name="Model"/>
    </shortcut>
  
  	
    
</izpack:shortcuts>